{
  "$schema": "https://json-schema.org/draft/2020-12/schema",
  "title": "Codex Native Capability Review Ledger",
  "type": "object",
  "additionalProperties": false,
  "required": ["schemaVersion", "reviewedAt", "codexVersion", "baselineReleaseTag", "latestReleaseTag", "changelogReviewedThrough", "sources", "releaseCoverage", "capabilities"],
  "properties": {
    "schemaVersion": {"const": 2},
    "reviewedAt": {"type": "string", "format": "date-time"},
    "codexVersion": {"type": "string", "minLength": 1},
    "baselineReleaseTag": {"type": "string", "pattern": "^rust-v[0-9]+\\.[0-9]+\\.[0-9]+$"},
    "latestReleaseTag": {"type": "string", "pattern": "^rust-v[0-9]+\\.[0-9]+\\.[0-9]+$"},
    "changelogReviewedThrough": {"type": "string", "format": "date"},
    "sources": {
      "type": "array",
      "minItems": 3,
      "items": {
        "type": "object",
        "additionalProperties": false,
        "required": ["kind", "url", "sha256"],
        "properties": {
          "kind": {"enum": ["manual", "changelog", "release"]},
          "url": {"type": "string", "format": "uri"},
          "sha256": {"type": "string", "pattern": "^[a-f0-9]{64}$"}
        }
      }
    },
    "releaseCoverage": {
      "type": "array",
      "minItems": 1,
      "items": {
        "type": "object",
        "additionalProperties": false,
        "required": ["tag", "publishedAt", "capabilityIds"],
        "properties": {
          "tag": {"type": "string", "pattern": "^rust-v[0-9]+\\.[0-9]+\\.[0-9]+$"},
          "publishedAt": {"type": "string", "format": "date-time"},
          "capabilityIds": {
            "type": "array",
            "minItems": 1,
            "uniqueItems": true,
            "items": {"type": "string", "pattern": "^[a-z0-9-]+$"}
          }
        }
      }
    },
    "capabilities": {
      "type": "array",
      "minItems": 1,
      "items": {
        "type": "object",
        "additionalProperties": false,
        "required": ["id", "nativeFeature", "decision", "localOverlap", "action", "evidence"],
        "properties": {
          "id": {"type": "string", "pattern": "^[a-z0-9-]+$"},
          "nativeFeature": {"type": "string", "minLength": 1},
          "decision": {"enum": ["adopted", "replaced", "removed", "retained", "permission-gated"]},
          "localOverlap": {"type": "string", "minLength": 1},
          "action": {"type": "string", "minLength": 1},
          "evidence": {
            "type": "array",
            "minItems": 1,
            "items": {"type": "string", "minLength": 1}
          }
        }
      }
    }
  }
}
