{
  "schemaVersion": 2,
  "reviewedAt": "2026-09-09T18:09:54+00:00",
  "codexVersion": "codex-cli 0.153.4",
  "baselineReleaseTag": "rust-v0.149.0",
  "latestReleaseTag": "rust-v0.153.4",
  "changelogReviewedThrough": "2026-09-08",
  "sources": [
    {
      "kind": "manual",
      "url": "https://developers.openai.com/codex/",
      "sha256": "1054faa7085722a9fe9c578b458e746d1b385a0e357231d2a25b4f5748951277"
    },
    {
      "kind": "changelog",
      "url": "https://learn.chatgpt.com/docs/changelog",
      "sha256": "e5d2f3b21a72b2b3b0a80b4d3a1322a8b9cd052cd0e2cfd4e93226358b33d4b4"
    },
    {
      "kind": "release",
      "url": "https://api.github.com/repos/openai/codex/releases/latest",
      "sha256": "125de93cdb8041b9713728243dbf2674b0f062285335381cc35598a8ff36a98b"
    }
  ],
  "releaseCoverage": [
    {
      "tag": "rust-v0.149.1",
      "publishedAt": "2026-08-24T00:28:28Z",
      "capabilityIds": ["runtime-maintenance-release"]
    },
    {
      "tag": "rust-v0.150.0",
      "publishedAt": "2026-08-26T19:37:28Z",
      "capabilityIds": ["task-ergonomics", "conversation-export", "async-mcp-hooks"]
    },
    {
      "tag": "rust-v0.150.1",
      "publishedAt": "2026-08-27T01:56:54Z",
      "capabilityIds": ["native-token-optimizations"]
    },
    {
      "tag": "rust-v0.151.0",
      "publishedAt": "2026-08-29T09:55:39Z",
      "capabilityIds": ["portable-plugins", "fork-permission-restoration", "native-agent-lifecycle", "async-mcp-hooks"]
    },
    {
      "tag": "rust-v0.152.0",
      "publishedAt": "2026-09-01T01:58:32Z",
      "capabilityIds": ["mcp-output-limits", "plan-tool-availability", "fork-permission-restoration"]
    },
    {
      "tag": "rust-v0.152.1",
      "publishedAt": "2026-09-01T22:33:02Z",
      "capabilityIds": ["native-doctor-diagnostics"]
    },
    {
      "tag": "rust-v0.153.0",
      "publishedAt": "2026-09-03T01:37:38Z",
      "capabilityIds": ["plugin-marketplace-cli", "task-ergonomics", "async-user-questions", "experimental-context-management", "fork-permission-restoration"]
    },
    {
      "tag": "rust-v0.153.1",
      "publishedAt": "2026-09-03T21:02:56Z",
      "capabilityIds": ["native-model-defaults"]
    },
    {
      "tag": "rust-v0.153.2",
      "publishedAt": "2026-09-03T23:53:12Z",
      "capabilityIds": ["native-model-defaults"]
    },
    {
      "tag": "rust-v0.153.3",
      "publishedAt": "2026-09-04T19:01:32Z",
      "capabilityIds": ["native-model-defaults"]
    },
    {
      "tag": "rust-v0.153.4",
      "publishedAt": "2026-09-04T23:25:48Z",
      "capabilityIds": ["native-model-defaults"]
    }
  ],
  "capabilities": [
    {
      "id": "portable-plugins",
      "nativeFeature": "Portable Agent Plugins and repository marketplaces",
      "decision": "adopted",
      "localOverlap": "Direct pack projection remains necessary for REPO and IDE discovery during migration.",
      "action": "Pilot one bounded frontend-design plugin and preserve direct discovery without simultaneous duplicate installation.",
      "evidence": [
        ".agents/plugins/marketplace.json",
        "plugins/codex-frontend-design/.codex-plugin/plugin.json",
        "docs/skills-governance.md"
      ]
    },
    {
      "id": "scheduled-tasks",
      "nativeFeature": "Scheduled tasks, monitors, reminders, and later follow-up",
      "decision": "replaced",
      "localOverlap": "Repository pollers, retry daemons, and lifecycle hooks would duplicate native scheduling.",
      "action": "Route explicitly recurring work to native automations and keep repository workflow engines absent.",
      "evidence": [
        "AGENTS.md",
        "templates/global/AGENTS.md",
        "templates/project/AGENTS.md"
      ]
    },
    {
      "id": "task-ergonomics",
      "nativeFeature": "Task names, pins, sections, handoff, history-backed forks, native task dashboards, and queued task messages",
      "decision": "adopted",
      "localOverlap": "Local task registries, message queues, status dashboards, fork wrappers, and handoff files duplicate native task state and coordination.",
      "action": "Use a fork only for an explicitly requested history-backed alternative, a new task for independent context, and a subagent for bounded current-request work; keep parallel writers in separate worktrees and use native task messaging and management.",
      "evidence": [
        "AGENTS.md",
        "templates/global/AGENTS.md",
        "README.md"
      ]
    },
    {
      "id": "native-doctor-diagnostics",
      "nativeFeature": "Codex doctor endpoint-protection, network, desktop, update, storage, and runtime diagnostics",
      "decision": "adopted",
      "localOverlap": "Reimplementing provider, desktop, update, or runtime health probes in framework scripts would drift from the native diagnostic surface.",
      "action": "Delegate platform diagnostics to native codex doctor and keep framework-doctor limited to framework installation, ownership, prompt, pack, hook, and evidence checks.",
      "evidence": [
        "scripts/framework-doctor.sh",
        "scripts/framework-doctor-native.py",
        "README.md"
      ]
    },
    {
      "id": "fork-permission-restoration",
      "nativeFeature": "Resume and fork restoration of persisted working directory and active permission profile with configured-default resolution when persisted state is invalid",
      "decision": "adopted",
      "localOverlap": "A framework permission override would hide the native effective profile, while assuming restoration always succeeds could continue consequential work with broader configured defaults.",
      "action": "After resume or fork, verify the effective working directory and permission profile before consequential work; stop on mismatch and never treat default resolution as authorization for broader access.",
      "evidence": [
        "templates/global/AGENTS.md",
        "README.md",
        "docs/framework-audit-2026-08-21.md"
      ]
    },
    {
      "id": "async-mcp-hooks",
      "nativeFeature": "Asynchronous hooks and hook-initiated MCP tool calls",
      "decision": "retained",
      "localOverlap": "Using background or MCP hooks for routing, retries, task steering, context injection, or external mutations would violate the framework's deterministic hook boundary.",
      "action": "Retain one synchronous local PreToolUse safety hook; route background work and external actions through native tasks, automations, connectors, or the active agent.",
      "evidence": [
        "AGENTS.md",
        ".codex/config.toml",
        "scripts/hooks/pre-tool-use.sh",
        "README.md"
      ]
    },
    {
      "id": "skill-catalog-budget",
      "nativeFeature": "Configurable native skill-catalog token budget and recent or character-routed skill selection",
      "decision": "retained",
      "localOverlap": "A framework-side skill prompt injector or router would duplicate native discovery and selection.",
      "action": "Keep the native catalog default while prompt-input evidence shows complete core discovery without truncation; change the native budget only from measured catalog pressure, never add a local router.",
      "evidence": [
        "scripts/framework-doctor.sh",
        "skills/core.txt",
        "README.md"
      ]
    },
    {
      "id": "shared-thread-snapshots",
      "nativeFeature": "Read-only shared snapshots of local Codex threads",
      "decision": "permission-gated",
      "localOverlap": "A framework transcript exporter or auto-share workflow could expose sensitive history and would duplicate native snapshot controls and revocation.",
      "action": "Use native sharing only on explicit request after reviewing the snapshot audience and content; never auto-share, and keep export or redaction wrappers absent.",
      "evidence": [
        "templates/global/AGENTS.md",
        "README.md",
        "docs/framework-audit-2026-08-21.md"
      ]
    },
    {
      "id": "conversation-export",
      "nativeFeature": "Complete TUI conversation export to Markdown or the clipboard with /export",
      "decision": "permission-gated",
      "localOverlap": "Automatic transcript export or a framework exporter could disclose prompts, tool output, credentials, or proprietary context and would duplicate native export controls.",
      "action": "Export only on explicit user request after reviewing the exact destination and transcript content; never auto-export or treat native secret-pattern handling as complete disclosure review.",
      "evidence": [
        "templates/global/AGENTS.md",
        "README.md",
        "docs/framework-audit-2026-08-21.md"
      ]
    },
    {
      "id": "browser-developer-mode",
      "nativeFeature": "Visible Browser with DOM, console, network, runtime, and profiling evidence",
      "decision": "adopted",
      "localOverlap": "Browser reset wrappers and silent headless acceptance duplicate or weaken native Browser control.",
      "action": "Start visible interactive UI verification early and retain headless checks only as supplemental regression evidence.",
      "evidence": [
        "AGENTS.md",
        "docs/interactive-development.md",
        "README.md"
      ]
    },
    {
      "id": "record-and-replay",
      "nativeFeature": "Record and Replay for demonstrated Computer Use workflows",
      "decision": "permission-gated",
      "localOverlap": "A repository recorder or browser macro would bypass native consent and availability gates.",
      "action": "Offer only after a user demonstrates a repetitive workflow; never enable or simulate recording automatically.",
      "evidence": [
        "AGENTS.md",
        "docs/framework-audit-2026-08-11.md"
      ]
    },
    {
      "id": "native-review",
      "nativeFeature": "GitHub integration, codex review, and approval review",
      "decision": "adopted",